{
  "scenario_id": "SC-027",
  "category": "rule_coverage",
  "description": "SP-006: QC fails, insufficient tissue (biopsy) → ORDER_TERMINATED_QNS",
  "events": [
    {
      "step": 1,
      "event_type": "order_received",
      "event_data": {
        "patient_name": "TESTPATIENT-0027, Grace",
        "age": 51,
        "sex": "F",
        "specimen_type": "biopsy",
        "anatomic_site": "breast",
        "fixative": "formalin",
        "fixation_time_hours": 24.0,
        "ordered_tests": [
          "Breast IHC Panel"
        ],
        "priority": "routine",
        "billing_info_present": true
      },
      "expected_output": {
        "next_state": "ACCEPTED",
        "applied_rules": [
          "ACC-008"
        ],
        "flags": []
      }
    },
    {
      "step": 2,
      "event_type": "grossing_complete",
      "event_data": {
        "outcome": "success"
      },
      "expected_output": {
        "next_state": "SAMPLE_PREP_PROCESSING",
        "applied_rules": [
          "SP-001"
        ],
        "flags": []
      }
    },
    {
      "step": 3,
      "event_type": "processing_complete",
      "event_data": {
        "outcome": "success"
      },
      "expected_output": {
        "next_state": "SAMPLE_PREP_EMBEDDING",
        "applied_rules": [
          "SP-001"
        ],
        "flags": []
      }
    },
    {
      "step": 4,
      "event_type": "embedding_complete",
      "event_data": {
        "outcome": "success"
      },
      "expected_output": {
        "next_state": "SAMPLE_PREP_SECTIONING",
        "applied_rules": [
          "SP-001"
        ],
        "flags": []
      }
    },
    {
      "step": 5,
      "event_type": "sectioning_complete",
      "event_data": {
        "outcome": "success"
      },
      "expected_output": {
        "next_state": "SAMPLE_PREP_QC",
        "applied_rules": [
          "SP-001"
        ],
        "flags": []
      }
    },
    {
      "step": 6,
      "event_type": "sample_prep_qc",
      "event_data": {
        "outcome": "fail_qns"
      },
      "expected_output": {
        "next_state": "ORDER_TERMINATED_QNS",
        "applied_rules": [
          "SP-006"
        ],
        "flags": []
      }
    }
  ]
}
