{
  "scenario_id": "SC-053",
  "category": "rule_coverage",
  "description": "IHC-003: 3 of 5 slides complete, 2 pending \u2192 hold at IHC_QC (per-slide event_data)",
  "events": [
    {
      "step": 1,
      "event_type": "order_received",
      "event_data": {
        "patient_name": "TESTPATIENT-0053, Frances",
        "age": 44,
        "sex": "F",
        "specimen_type": "excision",
        "anatomic_site": "breast",
        "fixative": "formalin",
        "fixation_time_hours": 36.0,
        "ordered_tests": [
          "Breast IHC Panel"
        ],
        "priority": "rush",
        "billing_info_present": true
      },
      "expected_output": {
        "next_state": "ACCEPTED",
        "applied_rules": [
          "ACC-008"
        ],
        "flags": []
      }
    },
    {
      "step": 2,
      "event_type": "grossing_complete",
      "event_data": {
        "outcome": "success"
      },
      "expected_output": {
        "next_state": "SAMPLE_PREP_PROCESSING",
        "applied_rules": [
          "SP-001"
        ],
        "flags": []
      }
    },
    {
      "step": 3,
      "event_type": "processing_complete",
      "event_data": {
        "outcome": "success"
      },
      "expected_output": {
        "next_state": "SAMPLE_PREP_EMBEDDING",
        "applied_rules": [
          "SP-001"
        ],
        "flags": []
      }
    },
    {
      "step": 4,
      "event_type": "embedding_complete",
      "event_data": {
        "outcome": "success"
      },
      "expected_output": {
        "next_state": "SAMPLE_PREP_SECTIONING",
        "applied_rules": [
          "SP-001"
        ],
        "flags": []
      }
    },
    {
      "step": 5,
      "event_type": "sectioning_complete",
      "event_data": {
        "outcome": "success"
      },
      "expected_output": {
        "next_state": "SAMPLE_PREP_QC",
        "applied_rules": [
          "SP-001"
        ],
        "flags": []
      }
    },
    {
      "step": 6,
      "event_type": "sample_prep_qc",
      "event_data": {
        "outcome": "pass"
      },
      "expected_output": {
        "next_state": "HE_STAINING",
        "applied_rules": [
          "SP-004"
        ],
        "flags": []
      }
    },
    {
      "step": 7,
      "event_type": "he_staining_complete",
      "event_data": {
        "fixation_issue": false
      },
      "expected_output": {
        "next_state": "HE_QC",
        "applied_rules": [],
        "flags": []
      }
    },
    {
      "step": 8,
      "event_type": "he_qc",
      "event_data": {
        "outcome": "pass"
      },
      "expected_output": {
        "next_state": "PATHOLOGIST_HE_REVIEW",
        "applied_rules": [
          "HE-001"
        ],
        "flags": []
      }
    },
    {
      "step": 9,
      "event_type": "pathologist_he_review",
      "event_data": {
        "diagnosis": "invasive_carcinoma",
        "added_markers": [
          "E-cadherin"
        ]
      },
      "expected_output": {
        "next_state": "IHC_STAINING",
        "applied_rules": [
          "HE-005"
        ],
        "flags": []
      }
    },
    {
      "step": 10,
      "event_type": "ihc_staining_complete",
      "event_data": {
        "outcome": "success"
      },
      "expected_output": {
        "next_state": "IHC_QC",
        "applied_rules": [],
        "flags": []
      }
    },
    {
      "step": 11,
      "event_type": "ihc_qc",
      "event_data": {
        "slides": [
          {"test": "ER", "qc_result": "pass"},
          {"test": "PR", "qc_result": "pass"},
          {"test": "HER2", "qc_result": "pending"},
          {"test": "Ki-67", "qc_result": "pending"},
          {"test": "E-cadherin", "qc_result": "pass"}
        ],
        "all_slides_complete": false,
        "slides_complete": 3,
        "slides_pending": 2
      },
      "expected_output": {
        "next_state": "IHC_QC",
        "applied_rules": [
          "IHC-003"
        ],
        "flags": []
      }
    }
  ]
}
