{
  "scenario_id": "SC-084",
  "category": "multi_rule",
  "description": "H&E QC ambiguity: restain vs recut \u2014 backup slides available, restain preferred \u2192 HE_STAINING (HE-002)",
  "events": [
    {
      "step": 1,
      "event_type": "order_received",
      "event_data": {
        "patient_name": "TESTPATIENT-0084, Karen",
        "age": 57,
        "sex": "F",
        "specimen_type": "excision",
        "anatomic_site": "breast",
        "fixative": "formalin",
        "fixation_time_hours": 24.0,
        "ordered_tests": [
          "Breast IHC Panel"
        ],
        "priority": "routine",
        "billing_info_present": true
      },
      "expected_output": {
        "next_state": "ACCEPTED",
        "applied_rules": [
          "ACC-008"
        ],
        "flags": []
      }
    },
    {
      "step": 2,
      "event_type": "grossing_complete",
      "event_data": {
        "outcome": "success"
      },
      "expected_output": {
        "next_state": "SAMPLE_PREP_PROCESSING",
        "applied_rules": [
          "SP-001"
        ],
        "flags": []
      }
    },
    {
      "step": 3,
      "event_type": "processing_complete",
      "event_data": {
        "outcome": "success"
      },
      "expected_output": {
        "next_state": "SAMPLE_PREP_EMBEDDING",
        "applied_rules": [
          "SP-001"
        ],
        "flags": []
      }
    },
    {
      "step": 4,
      "event_type": "embedding_complete",
      "event_data": {
        "outcome": "success"
      },
      "expected_output": {
        "next_state": "SAMPLE_PREP_SECTIONING",
        "applied_rules": [
          "SP-001"
        ],
        "flags": []
      }
    },
    {
      "step": 5,
      "event_type": "sectioning_complete",
      "event_data": {
        "outcome": "success"
      },
      "expected_output": {
        "next_state": "SAMPLE_PREP_QC",
        "applied_rules": [
          "SP-001"
        ],
        "flags": []
      }
    },
    {
      "step": 6,
      "event_type": "sample_prep_qc",
      "event_data": {
        "outcome": "pass"
      },
      "expected_output": {
        "next_state": "HE_STAINING",
        "applied_rules": [
          "SP-004"
        ],
        "flags": []
      }
    },
    {
      "step": 7,
      "event_type": "he_staining_complete",
      "event_data": {
        "fixation_issue": false
      },
      "expected_output": {
        "next_state": "HE_QC",
        "applied_rules": [],
        "flags": []
      }
    },
    {
      "step": 8,
      "event_type": "he_qc",
      "event_data": {
        "outcome": "fail_restain",
        "backup_slides_available": true
      },
      "expected_output": {
        "next_state": "HE_STAINING",
        "applied_rules": [
          "HE-002"
        ],
        "flags": []
      }
    }
  ]
}
