{
  "scenario_id": "SC-102",
  "category": "unknown_input",
  "description": "Ambiguous anatomic site 'skin overlying breast' \u2192 DO_NOT_PROCESS (ACC-003); not clearly breast-cancer-relevant tissue (acceptable alternative: ACCEPTED if model interprets as breast)",
  "events": [
    {
      "step": 1,
      "event_type": "order_received",
      "event_data": {
        "patient_name": "TESTPATIENT-0102, Alice",
        "age": 55,
        "sex": "F",
        "specimen_type": "biopsy",
        "anatomic_site": "skin overlying breast",
        "fixative": "formalin",
        "fixation_time_hours": 24.0,
        "ordered_tests": [
          "Breast IHC Panel"
        ],
        "priority": "routine",
        "billing_info_present": true
      },
      "expected_output": {
        "next_state": "DO_NOT_PROCESS",
        "applied_rules": [
          "ACC-003"
        ],
        "flags": []
      }
    }
  ]
}
