{
  "scenario_id": "SC-019",
  "category": "rule_coverage",
  "description": "SP-002: Processing fails, tissue available (excision) → retry SAMPLE_PREP_PROCESSING (self-loop)",
  "events": [
    {
      "step": 1,
      "event_type": "order_received",
      "event_data": {
        "patient_name": "TESTPATIENT-0019, Laura",
        "age": 49,
        "sex": "F",
        "specimen_type": "excision",
        "anatomic_site": "breast",
        "fixative": "formalin",
        "fixation_time_hours": 18.0,
        "ordered_tests": [
          "Breast IHC Panel"
        ],
        "priority": "routine",
        "billing_info_present": true
      },
      "expected_output": {
        "next_state": "ACCEPTED",
        "applied_rules": [
          "ACC-008"
        ],
        "flags": []
      }
    },
    {
      "step": 2,
      "event_type": "grossing_complete",
      "event_data": {
        "outcome": "success"
      },
      "expected_output": {
        "next_state": "SAMPLE_PREP_PROCESSING",
        "applied_rules": [
          "SP-001"
        ],
        "flags": []
      }
    },
    {
      "step": 3,
      "event_type": "processing_complete",
      "event_data": {
        "outcome": "failure"
      },
      "expected_output": {
        "next_state": "SAMPLE_PREP_PROCESSING",
        "applied_rules": [
          "SP-002"
        ],
        "flags": []
      }
    }
  ]
}
