{
  "scenario_id": "SC-080",
  "category": "multi_rule",
  "description": "Multiple accessioning defects: missing name (ACC-001) + invalid site (ACC-003) \u2192 DO_NOT_PROCESS; REJECT beats HOLD",
  "events": [
    {
      "step": 1,
      "event_type": "order_received",
      "event_data": {
        "patient_name": null,
        "age": 62,
        "sex": "F",
        "specimen_type": "biopsy",
        "anatomic_site": "lung",
        "fixative": "formalin",
        "fixation_time_hours": 24.0,
        "ordered_tests": [
          "Breast IHC Panel"
        ],
        "priority": "routine",
        "billing_info_present": true
      },
      "expected_output": {
        "next_state": "DO_NOT_PROCESS",
        "applied_rules": [
          "ACC-001",
          "ACC-003"
        ],
        "flags": []
      }
    }
  ]
}
