{
  "scenario_id": "SC-021",
  "category": "rule_coverage",
  "description": "SP-003: Processing fails, insufficient tissue (biopsy) → ORDER_TERMINATED_QNS",
  "events": [
    {
      "step": 1,
      "event_type": "order_received",
      "event_data": {
        "patient_name": "TESTPATIENT-0021, Patricia",
        "age": 44,
        "sex": "F",
        "specimen_type": "biopsy",
        "anatomic_site": "breast",
        "fixative": "formalin",
        "fixation_time_hours": 12.0,
        "ordered_tests": [
          "Breast IHC Panel"
        ],
        "priority": "rush",
        "billing_info_present": true
      },
      "expected_output": {
        "next_state": "ACCEPTED",
        "applied_rules": [
          "ACC-008"
        ],
        "flags": []
      }
    },
    {
      "step": 2,
      "event_type": "grossing_complete",
      "event_data": {
        "outcome": "success"
      },
      "expected_output": {
        "next_state": "SAMPLE_PREP_PROCESSING",
        "applied_rules": [
          "SP-001"
        ],
        "flags": []
      }
    },
    {
      "step": 3,
      "event_type": "processing_complete",
      "event_data": {
        "outcome": "failure"
      },
      "expected_output": {
        "next_state": "ORDER_TERMINATED_QNS",
        "applied_rules": [
          "SP-003"
        ],
        "flags": []
      }
    }
  ]
}
