{
  "scenario_id": "SC-011",
  "category": "rule_coverage",
  "description": "ACC-005: HER2 ordered with non-formalin fixative (fresh), order rejected",
  "events": [
    {
      "step": 1,
      "event_type": "order_received",
      "event_data": {
        "patient_name": "TESTPATIENT-0011, Michael",
        "age": 45,
        "sex": "F",
        "specimen_type": "biopsy",
        "anatomic_site": "breast",
        "fixative": "fresh",
        "fixation_time_hours": 24.0,
        "ordered_tests": [
          "Breast IHC Panel"
        ],
        "priority": "routine",
        "billing_info_present": true
      },
      "expected_output": {
        "next_state": "DO_NOT_PROCESS",
        "applied_rules": [
          "ACC-005"
        ],
        "flags": []
      }
    }
  ]
}
